{
  "spec_version": "0.1",
  "id": "hermes-agent-pr-62413",
  "source": {
    "kind": "pr",
    "repo": "NousResearch/hermes-agent",
    "pr_number": 62413,
    "issue_numbers": [
      54527
    ],
    "related_prs": [
      62134,
      62144
    ],
    "merged_at": "2026-07-11T02:35:06Z"
  },
  "narrative_density": "long-form",
  "title": "The message that filed itself under the wrong session",
  "logline": "A debounce timer and a rejected-submit restore both wrote drafts using whatever session was focused *when they fired*, not the one that owned the text — so a long, careful message vanished into another chat.",
  "concepts": [
    {
      "id": "render-ref-vs-swap-owned-ref",
      "name": "swap-owned ref",
      "aliases": [
        "draftScopeRef",
        "swap-owned ref",
        "swap effect"
      ],
      "intro": {
        "one_liner": "A ref updated only by the session-switch effect, not on every render — so async code reads the session that's actually loaded, not whatever's focused right now.",
        "full": "`activeQueueSessionKeyRef` gets reassigned on every render, so by the time an async callback (a debounce timer, a `pagehide` handler) reads it, it may already point at whatever session the user switched to — not the one whose text it's supposed to persist. `draftScopeRef` fixes this by only being written inside the swap effect, the one place that actually owns 'which session's draft is loaded right now.' Anything scheduled while a session is loaded captures that ref's value and keeps it, even if the render-time ref moves on underneath it."
      },
      "area": "desktop/composer"
    },
    {
      "id": "route-token-pinning",
      "name": "route token",
      "aliases": [
        "route token",
        "getRouteToken"
      ],
      "intro": {
        "one_liner": "A token captured at submit time that identifies which session a reply belongs to, checked again before delivery.",
        "full": "When a prompt is submitted, the code now grabs `getRouteToken()` and the current stored session id at that moment. Async resume, attachment sync, and timeout recovery use those captured values instead of re-reading 'what session is focused now.' If the token no longer matches by the time a response is ready to land, the delivery is treated as stale and rolled back instead of appended to whatever chat happens to be open."
      },
      "area": "desktop/session"
    },
    {
      "id": "pending-write-integrity-guard",
      "name": "integrity guard",
      "aliases": [
        "isPendingDraftPersistCurrent",
        "integrity guard"
      ],
      "intro": {
        "one_liner": "Before a delayed write commits, it checks it's still the pending write on file — not superseded by a clear or a newer one.",
        "full": "`isPendingDraftPersistCurrent` compares a `{scope, text}` pair against whatever's currently recorded as pending. A debounce timer captures its pair when scheduled, but doesn't fire until later — by then a session swap may have cleared the pending slot, or a newer keystroke may have replaced it. The guard drops the write in either case instead of letting a stale timer overwrite fresh text. It's defense-in-depth: the scope-capture fix already makes every captured pair correct, this just stops a future regression from silently misfiling one session's text under another's key."
      },
      "area": "desktop/composer"
    }
  ],
  "cast": [
    {
      "id": "hexlab98",
      "label": "@HexLab98",
      "role": "author of the submit/resume routing fix"
    },
    {
      "id": "joaomarcos44",
      "label": "@JoaoMarcos44",
      "role": "author of the composer draft-scope fix"
    },
    {
      "id": "teknium1",
      "label": "@teknium1",
      "role": "author of the consolidating PR"
    },
    {
      "id": "alt-glitch",
      "label": "@alt-glitch",
      "role": "maintainer flagging the duplicate-PR cluster"
    }
  ],
  "panels": [
    {
      "beat": "cold-open",
      "body": "Two Hermes Desktop sessions are open: **Session A**, an existing Flappy Royale chat, and **Session B**, a fresh session for a new project. The user types a long, carefully composed prompt into Session B — then switches to check Session A.",
      "figure": {
        "type": "scene",
        "caption": "The message that never made it",
        "actors": [
          {
            "id": "session-a",
            "label": "Session A (Flappy Royale)",
            "x": 20,
            "y": 30,
            "kind": "frontend"
          },
          {
            "id": "session-b",
            "label": "Session B (fresh)",
            "x": 80,
            "y": 30,
            "kind": "frontend"
          },
          {
            "id": "draft-store",
            "label": "Draft store",
            "x": 50,
            "y": 75,
            "kind": "backend"
          }
        ],
        "steps": [
          {
            "action": "appear",
            "actor": "session-a",
            "note": "Session A is open — an existing project chat"
          },
          {
            "action": "appear",
            "actor": "session-b",
            "note": "Session B opens — a fresh session"
          },
          {
            "action": "type",
            "actor": "session-b",
            "text": "carefully composed prompt...",
            "note": "User types a long message into Session B"
          },
          {
            "action": "move",
            "actor": "session-b",
            "to": "session-a",
            "text": "focus",
            "note": "User switches focus to Session A before the debounce fires"
          },
          {
            "action": "flow",
            "actor": "draft-store",
            "to": "session-a",
            "label": "stashAt(scope, text)",
            "fault": true,
            "note": "Debounce timer fires — reads the render-time ref, which now says Session A"
          },
          {
            "action": "vanish",
            "actor": "session-b",
            "note": "Session B's message is filed under Session A's key and never seen again"
          }
        ]
      }
    },
    {
      "beat": "incident",
      "body": "The linked bug, #54527, reports the loss as **permanent**: the text typed into Session B never appears in any session transcript or the message database. Two independent contributors filed fixes for two different manifestations of the same root shape."
    },
    {
      "beat": "concept-intro",
      "concept_ref": "render-ref-vs-swap-owned-ref",
      "body": "The draft debounce, page-hide flush, and rejected-submit restore all needed to answer one question: **which session's text is this?** Before this PR, they answered it by reading a ref that updates on every render — `activeQueueSessionKeyRef` — at the moment the async work finally runs, not at the moment it was scheduled."
    },
    {
      "beat": "hypothesis",
      "hypothesis_id": "h-draft-scope",
      "body": "**@JoaoMarcos44's angle:** the bug is in the composer. The debounce timer and `pagehide` flush capture `activeQueueSessionKeyRef.current` when they fire, but the user may have switched sessions in the meantime — the ref has moved on. Fix: pin persistence to the session that's actually loaded in the editor, via a **swap-owned ref**."
    },
    {
      "beat": "hypothesis",
      "hypothesis_id": "h-submit-routing",
      "body": "**@HexLab98's angle:** the bug is in submit/resume routing. Async resume, attachment sync, and timeout recovery for a submitted prompt can complete well after the user has switched sessions — and reconnect to whatever session is now focused, delivering the reply into the wrong chat. Fix: pin the starting stored session and a **route token** captured at submit time, and abort delivery on drift."
    },
    {
      "beat": "investigation",
      "body": "A maintainer comment on the PR cluster confirms both are real, independent races on the same underlying shape: async work started under one session, completing after focus moved to another. #62134 (HexLab98) and #62144 (JoaoMarcos44) each fixed one half. Neither fixed the other."
    },
    {
      "beat": "prediction",
      "body": "Before the reveal — given both hypotheses above, what should the merged fix actually do?",
      "prediction": {
        "question": "Given draft-scope pinning fixes the composer half and route-token pinning fixes the submit half, what should PR #62413 do?",
        "options": [
          {
            "id": "pick-one",
            "text": "Merge whichever branch is more complete and close the other",
            "maps_to_hypothesis": "h-draft-scope"
          },
          {
            "id": "combine-both",
            "text": "Take both mechanisms — draft-scope pinning AND route-token pinning — without adopting either branch wholesale"
          },
          {
            "id": "rewrite-shared",
            "text": "Write one new shared abstraction that replaces both refs with a single session-locking hook"
          }
        ],
        "answer": "combine-both",
        "feedback": {
          "pick-one": "Tempting, but the two fixes cover different code paths (composer drafts vs. submit/resume routing) — picking one leaves the other race live.",
          "combine-both": "Correct. The PR body states it explicitly: combine the two independent fixes 'without taking either contributor's broader branch wholesale.' Each mechanism is minimal and scoped to its own path.",
          "rewrite-shared": "Half credit for the instinct — a shared abstraction is plausible engineering, but nothing in the PR data suggests one was built. The actual fix keeps the two mechanisms separate."
        },
        "concept_ids": [
          "render-ref-vs-swap-owned-ref",
          "route-token-pinning"
        ]
      }
    },
    {
      "beat": "reveal",